ID,movie_name,year,Timing(min),Rating(10),Votes,Genre,Language,movie_id,genre,overview,director,cast,is_indian,movie_age,release_decade
tt0443594,naina,2005.0,104 min,4.2,766,"Drama, Horror, Mystery            ",hindi,tt0443594,"Drama, Horror, Mystery","After receiving an eye transplant, a young woman realizes that she can see into the supernatural world.",Shripal Morakhia,"Urmila Matondkar, Anuj Sawhney, Malavika Nair, Amardeep Jha",1,20.0,2000.0s
-,koochie koochie hota hai,2021.0,-,,-,"Animation, Family, Musical            ",hindi,tt1609138,"Animation, Family, Musical","The film is an animated take on Kuch Kuch Hota Hai, and it marks the 20 year anniversary of its release.",Tarun Mansukhani,"Shah Rukh Khan, Kajol, Rani Mukerji, Sanjay Dutt",1,4.0,2020.0s
tt1828289,shagird,2011.0,143 min,7.1,"1,907","Action, Crime, Drama            ",hindi,tt1828289,"Action, Crime, Drama","A rookie cop questions the tactics of his superior, and attempts to track the abductors of his girlfriend.",Tigmanshu Dhulia,"Nana Patekar, Mohit Ahlawat, Rimi Sen, Anurag Kashyap",1,14.0,2010.0s
tt1954470,gangs of wasseypur,2012.0,321 min,8.2,"84,087","Action, Comedy, Crime            ",hindi,tt1954470,"Action, Comedy, Crime","A clash between Sultan and Shahid Khan leads to the expulsion of Khan from Wasseypur, and ignites a deadly blood feud spanning three generations.",Anurag Kashyap,"Manoj Bajpayee, Nawazuddin Siddiqui, Tigmanshu Dhulia, Richa Chadha",1,13.0,2010.0s
tt0259322,gehrayee,1980.0,135 min,6.8,146,"Drama, Horror            ",hindi,tt0259322,"Drama, Horror","When a successful manager decides to sell his plantation in his ancestral village to another company, his young daughter begins acting very strangely.","Vikas Desai, Aruna Raje","Shreeram Lagoo, Anant Nag, Indrani Mukherjee, Padmini Kolhapure",1,45.0,1980.0s
tt0101244,100 days,1991.0,161 min,6.5,963,"Horror, Romance, Thriller            ",hindi,tt0101244,"Horror, Romance, Thriller","A young, clairvoyant woman has a vision of a murder and sets out to uncover the truth before the killer finds her.",Partho Ghosh,"Jackie Shroff, Madhuri Dixit, Jaaved Jaaferi, Laxmikant Berde",1,34.0,1990.0s
tt11112526,indoo ki jawani,2020.0,119 min,2.6,"4,829","Comedy, Drama            ",hindi,tt11112526,"Comedy, Drama",A coming-of-age story of a girl who experience life through misadventures & dating apps.,Abir Sengupta,"Kiara Advani, Aditya Seal, Mallika Dua, Kimsa Sok",1,5.0,2020.0s
tt1562859,golmaal 3,2010.0,155 min,5.5,"7,509","Action, Comedy            ",hindi,tt1562859,"Action, Comedy, Drama","In Goa, Pritam meets his love Geeta after many years. They decide to get married but the feud between their respective children creates tension in their marriage.",Rohit Shetty,"Mithun Chakraborty, Ajay Devgn, Kareena Kapoor, Tusshar Kapoor",1,15.0,2010.0s
tt0214665,ek phool do mali,1969.0,150 min,6.6,204,"Drama, Family, Musical            ",hindi,tt0214665,"Drama, Family, Musical","Somna lives a poor lifestyle with her widowed mom Leela, in the mountainous region of India and Nepal. She makes a living working on the apple farm of wealthy widower Kailash Nath Kaushal, ...                See full summary »",Devendra Goel,"Sanjay Khan, Balraj Sahni, Sadhana Shivdasani, Durga Khote",1,56.0,1960.0s
tt0075669,amar akbar anthony,1977.0,184 min,7.5,"7,259","Action, Comedy, Drama            ",hindi,tt0075669,"Action, Comedy, Drama","Three brothers are separated and united after many years - one is brought up a Hindu, another a Muslim and the last (and most memorable) a Christian. Hilarity and adventure ensues.",Manmohan Desai,"Vinod Khanna, Rishi Kapoor, Amitabh Bachchan, Shabana Azmi",1,48.0,1970.0s
tt1736552,breakaway,2011.0,101 min,5.7,"2,217","Comedy, Drama, Sport            ",punjabi,tt1736552,"Comedy, Drama, Sport",An ethnic Canadian hockey player struggles against traditional family values and discrimination from mainstream hockey players.,Robert Lieberman,"Vinay Virmani, Camilla Belle, Russell Peters, Rob Lowe",1,14.0,2010.0s
tt2122340,ferrari ki sawaari,2012.0,140 min,6.4,"5,080","Comedy, Drama, Family            ",hindi,tt2122340,"Comedy, Drama, Family",How the pursuit of an Indian cricket legend's Ferrari makes a young boy's dreams of playing cricket at Lords a reality.,Rajesh Mapuskar,"Sharman Joshi, Boman Irani, Ritvik Sahore, Paresh Rawal",1,13.0,2010.0s
tt5313980,tere bin laden: dead or alive,2016.0,104 min,4.3,851,Comedy            ,hindi,tt5313980,Comedy,A Bollywood director is hired by an American talent agent to make a film on Osama bin Laden. The plan to use an Osama doppelganger in order to prove his death boomerangs when a Taliban arms dealer hijacks their idea to prove he's alive.,"Abhishek Sharma, Deepak Chandra","Maniesh Paul, Pradhuman Singh, Sikandar Kher, Parthaa Akerkar",1,9.0,2010.0s
tt3771536,shivaay,2016.0,153 min,6.2,"9,795","Action, Adventure, Drama            ",hindi,tt3771536,"Action, Adventure, Crime",A skilled mountaineer races against time to rescue his mute daughter from the clutches of human traffickers in Bulgaria.,Ajay Devgn,"Ajay Devgn, Abigail Eames, Erika Kaar, Sayyeshaa Saigal",1,9.0,2010.0s
tt0089959,sanjog,1985.0,148 min,7.0,84,Drama            ,hindi,tt0089959,Drama,"Bombay-bred Narain goes to a village, where he meets and falls in love with a village belle, Yashodra. She also is attracted to him, and both get married. After their marriage, both go to ...                See full summary »",K. Viswanath,"Jeetendra, Jaya Prada, Vinod Mehra, Aruna Irani",1,40.0,1980.0s
tt0102071,hum,1991.0,184 min,6.8,"2,751","Action, Comedy, Drama            ",hindi,tt0102071,"Action, Comedy, Drama","A dockworker overthrows the tyranny of a cruel gangster but has to run away to make a new life for himself and his brothers. Fifteen years later, his past catches up with him as his old enemy resurfaces.",Mukul Anand,"Amitabh Bachchan, Rajinikanth, Govinda, Kimi Katkar",1,34.0,1990.0s
tt2406676,ek thi daayan,2013.0,135 min,5.7,"3,970","Horror, Romance, Thriller            ",hindi,tt2406676,"Horror, Romance, Thriller","When gifted magician Bobo finds himself assailed by hallucinations and seeks professional help, he learns he's being haunted by a sinister spirit.",Kannan Iyer,"Emraan Hashmi, Konkona Sen Sharma, Kalki Koechlin, Huma Qureshi",1,12.0,2010.0s
tt0080343,albert pinto ko gussa kyon ata hai,1980.0,110 min,7.5,421,"Comedy, Drama, Romance            ",hindi,tt0080343,"Comedy, Drama, Romance",A man from Mumbai (then Bombay) is angry about various issues in different circumstances.,Saeed Akhtar Mirza,"Naseeruddin Shah, Shabana Azmi, Smita Patil, Dilip Dhawan",1,45.0,1980.0s
tt0115484,agni sakshi,1996.0,142 min,6.1,672,"Drama, Musical, Romance            ",hindi,tt0115484,"Drama, Musical, Romance",Newly married Suraj and Shivangi are on honeymoon where they meet Vishwanath - who claims that Shivangi is his wife.,Partho Ghosh,"Jackie Shroff, Nana Patekar, Manisha Koirala, Divya Dutta",1,29.0,1990.0s
tt1020978,naqaab,2007.0,115 min,5.3,"1,365","Crime, Drama, Romance            ",hindi,tt1020978,"Crime, Drama, Romance","Sophia is engaged to millionaire Karan, who is completely in love with her. She, however, finds true love in Vicky and gets into a relationship that causes problems between her and Karan.","Abbas Alibhai Burmawalla, Mastan Alibhai Burmawalla","Bobby Deol, Akshaye Khanna, Urvashi Sharma, Vikas Kalantri",1,18.0,2000.0s
tt0112876,diya aur toofan,1995.0,-,4.3,51,"Action, Drama, Thriller            ",hindi,tt0112876,"Action, Drama, Thriller",Dr. Vijay performs a ground breaking surgical operation when he transplants the brain of a slain police officer on the brain-dead body of his to-be bride in order to avenge the death of the police officer.,K. Bapaiah,"Mithun Chakraborty, Madhoo, Maya Alagh, Vijay Arora",1,30.0,1990.0s
tt1261047,gulaal,2009.0,140 min,8.1,"14,070","Crime, Drama, Thriller            ",hindi,tt1261047,"Crime, Drama, Thriller","A law student witnesses deception, homicide, and crime after being elected as General Secretary of his college.",Anurag Kashyap,"Kay Kay Menon, Raj Singh Chaudhary, Raja Chaudhary, Jesse Randhawa",1,16.0,2000.0s
-,chehre,2021.0,-,,-,"Drama, Mystery, Thriller            ",hindi,tt10309902,"Drama, Mystery, Thriller","An 80-year-old man with a penchant for real life games in a story about rights and wrongs. It's a story about the decisions one makes in their lifetime and the fact that every decision has its repercussions, hearing and judgment.",Rumi Jaffery,"Amitabh Bachchan, Emraan Hashmi, Krystle D'Souza, Annu Kapoor",1,4.0,2020.0s
tt0477253,aashiq banaya aapne: love takes over,2005.0,115 min,4.3,"1,550","Drama, Romance, Thriller            ",hindi,tt0477253,"Drama, Romance, Thriller","An introvert is unable to express his feelings to the girl he loves. His friend proposes to her and she accepts, but leaves him when she discovers he is a flirt; however, destiny has other plans.",Aditya Datt,"Emraan Hashmi, Tanushree Dutta, Sonu Sood, Preeti Ganguli",1,20.0,2000.0s
tt0400234,black friday,2004.0,143 min,8.5,"19,134","Action, Crime, Drama            ",hindi,tt0400234,"Action, Crime, Drama","A film about the investigations following the 1993 serial Bombay bomb blasts, told through the different stories of the people involved --police, conspirators, victims, middlemen.",Anurag Kashyap,"Kay Kay Menon, Pawan Malhotra, Aditya Srivastav, Dibyendu Bhattacharya",1,21.0,2000.0s
tt0253514,purana mandir,1984.0,144 min,6.3,486,"Comedy, Drama, Horror            ",hindi,tt0253514,"Drama, Horror","After a rich young girl learns about a demon and it's terrible curse brought by her family for generations, she decides to go to her paternal village with her lover, and his friend, to find out the truth.","Shyam Ramsay, Tulsi Ramsay","Mohnish Behl, Arti Gupta, Puneet Issar, Sadashiv Amrapurkar",1,41.0,1980.0s
tt4302956,kis kisko pyaar karoon,2015.0,133 min,5.7,"5,640","Comedy, Romance            ",hindi,tt4302956,"Comedy, Romance","A comedy or errors, wherein a married man attempts to juggle his three wives along with his current girlfriend.","Abbas Alibhai Burmawalla, Mastan Alibhai Burmawalla, Abinash Rout","Kapil Sharma, Simran Kaur Mundi, Manjari Fadnnis, Sai Lokur",1,10.0,2010.0s
tt4387040,airlift,2016.0,130 min,8.0,"53,259","Drama, History            ",hindi,tt4387040,"Action, Drama, History","When Iraq invades Kuwait in August 1990, a callous Indian businessman becomes the spokesperson for more than 170,000 stranded countrymen.",Raja Menon,"Akshay Kumar, Nimrat Kaur, Kumud Mishra, Prakash Belawadi",1,9.0,2010.0s
tt4900716,kapoor & sons,2016.0,132 min,7.7,"23,680","Comedy, Drama, Family            ",hindi,tt4900716,"Comedy, Drama, Family",The story about two brothers who visit their dysfunctional family for their grandfather's birthday party.,Shakun Batra,"Rishi Kapoor, Rajat Kapoor, Ratna Pathak Shah, Fawad Khan",1,9.0,2010.0s
tt1327035,dev.d,2009.0,144 min,8.0,"28,998","Drama, Romance            ",hindi,tt1327035,"Comedy, Drama, Romance","After breaking up with his childhood sweetheart, a young man finds solace in drugs. Meanwhile, a teenage girl is caught in the world of prostitution. Will they be destroyed, or will they find redemption?",Anurag Kashyap,"Abhay Deol, Mahie Gill, Kalki Koechlin, Dibyendu Bhattacharya",1,16.0,2000.0s
tt0077797,khatta meetha,1978.0,128 min,7.5,847,"Comedy, Drama            ",hindi,tt0077797,"Comedy, Drama",Two old people get married and their children from their previous marriages now have to live together under the same roof. Clashes and hilarity ensue.,Basu Chatterjee,"Ashok Kumar, Rakesh Roshan, Bindiya Goswami, Raju Shrestha",1,47.0,1970.0s
tt12845296,the hidden strike,2020.0,100 min,3.5,41,War            ,hindi,tt12845296,War,The Hidden Strike is a fictional movie about a ground mission where a team of thirteen Indian Army officers and soldiers went across POK and destroyed the terrorist camp with a planned sub ...                See full summary »,Suzad Iqbal Khan,"Deepraj Rana, Mir Sarwar, Jimmy Sharma, Lakhwinder",1,5.0,2020.0s
tt0274019,pyaar diwana hota hai,2002.0,148 min,3.9,329,"Comedy, Drama, Romance            ",hindi,tt0274019,"Comedy, Drama, Romance",A villager pretends to be disabled in order to be near an NRI (Non-Resident Indian).,Pankaj Parashar,Shraddha Kapoor,1,23.0,2000.0s
tt1027800,angoor,2005.0,106 min,6.2,52,Drama            ,hindi,tt1027800,Drama,"A girl with mental problems gets break in C grade movie and try to woo the producer to increase her payment. In between, it turn out that producer is homosexual, and likes the male lead of ...                See full summary »",Kanti Shah,"Sapna Sappu, Rajesh Sabharwal, Amit Pachori, Anil Nagrath",1,20.0,2000.0s
tt0268449,mehbooba,1976.0,134 min,6.5,139,"Drama, Romance            ",hindi,tt0268449,"Drama, Romance","A singer by profession, Suraj (Rajesh Khanna) gets stranded in resthouse in the coutnryside during a rainstorm. While there he experiences ununsual feelings, as if he has been there before....                See full summary »",Shakti Samanta,"Rajesh Khanna, Hema Malini, Prem Chopra, Govardhan Asrani",1,49.0,1970.0s
tt2372222,kick,2014.0,146 min,5.3,"24,296","Action, Comedy, Crime            ",hindi,tt2372222,"Action, Comedy, Crime","An adrenaline junkie walks away from a whirlwind romance and embraces a new life as a thief, though he soon finds himself pursued by veteran police officer and engaged in a turf war with a local gangster.",Sajid Nadiadwala,"Salman Khan, Jacqueline Fernandez, Nawazuddin Siddiqui, Randeep Hooda",1,11.0,2010.0s
tt1836987,trishna,2011.0,117 min,6.0,"3,008",Drama            ,punjabi,tt1836987,Drama,The story of the tragic relationship between the son of a property developer and the daughter of an auto rickshaw owner.,Michael Winterbottom,"Freida Pinto, Riz Ahmed, Mita Vashisht, Harish Khanna",1,14.0,2010.0s
tt0449892,dadagiri,1987.0,-,5.4,49,"Action, Crime, Drama            ",hindi,tt0449892,"Action, Crime, Drama","After the passing of her parents, a young heiress suffers abuse at the hands of her relatives.",Deepak S. Shivdasani,"Rati Agnihotri, Rakesh Bedi, Mohan Choti, Sudhir Dalvi",1,38.0,1980.0s
tt0301215,doosara aadmi,1977.0,137 min,7.1,164,"Drama, Family, Romance            ",hindi,tt0301215,"Drama, Family, Romance","Kanu, Timsi and Nisha find themselves entangled in an emotional saga, the struggle of Nisha's past, Kanu and Timsi's present and an uncertain future.",Ramesh Talwar,"Shashi Kapoor, Rishi Kapoor, Neetu Singh, Rakhee Gulzar",1,48.0,1970.0s
tt0154565,haqeeqat,1964.0,184 min,7.8,455,"Action, Musical, War            ",hindi,tt0154565,"Action, Musical, War",A platoon of Indian soldiers encounters harsh realities while fighting in the Sino-Indian War of 1962.,Chetan Anand,"Balraj Sahni, Dharmendra, Vijay Anand, Indrani Mukherjee",1,61.0,1960.0s
tt4129428,jagga jasoos,2017.0,161 min,6.5,"9,287","Action, Adventure, Comedy            ",hindi,tt4129428,"Action, Adventure, Comedy","Join Jagga, a gifted teenage detective, who along with a female companion, is on a quest to find his missing father.","Anurag Basu, Shubzz","Ranbir Kapoor, Katrina Kaif, Saswata Chatterjee, Chitrak Bandyopadhyay",1,8.0,2010.0s
tt0069671,abhimaan,1973.0,122 min,7.9,"2,638","Drama, Musical            ",hindi,tt0069671,"Drama, Musical","A popular singer convinces his new wife to enter show-business, but his pride is wounded when she outshines him.",Hrishikesh Mukherjee,"Amitabh Bachchan, Jaya Bachchan, Govardhan Asrani, Bindu Desai",1,52.0,1970.0s
tt8698956,lupt,2018.0,110 min,5.5,"2,044","Horror, Thriller            ",hindi,tt8698956,"Horror, Thriller","Haunted by disturbing visions, a workaholic takes a vacation with his family, but a detour leads them to an unsettling stranger and chilling events.",Prabhuraj,"Jaaved Jaaferi, Niki Walia, Vijay Raaz, Rishab Chadha",1,7.0,2010.0s
tt0268166,baghavat,1982.0,144 min,6.4,65,"Action, Romance            ",hindi,tt0268166,"Action, Romance","The region under Maharaj Singh's control is under-going drought and famine-like conditions, and the Maharaj orders that the treasury be made open so that his public does not suffer. His ...                See full summary »",Ramanand Sagar,"Dharmendra, Hema Malini, Reena Roy, Amjad Khan",1,43.0,1980.0s
tt0359325,ghazab,1982.0,162 min,6.8,135,"Action, Comedy, Drama            ",hindi,tt0359325,"Action, Comedy, Drama","Ajay alias Munna Babu is a semi-senile, gentle but naive young man who has a wealthy family estate. His employees and alleged well-wishers (Arjun Singh, Jatha Shankar, Munishi Gurbachan, ...                See full summary »",C.P. Dixit,"Ranjeet Bedi, Seema Deo, Dharmendra, Krishan Dhawan",1,43.0,1980.0s
tt0256951,nadiya ke paar,1982.0,143 min,7.8,817,"Drama, Romance            ",hindi,tt0256951,"Drama, Romance","Chandan and Gunja, who hails from a village across the river, fall in love with each other. After her sister dies, Gunja is compelled to marry her brother-in-law who is Chandan's brother.",Govind Moonis,"Sachin Pilgaonkar, Sadhana Singh, Inder Thakur, Mitali",1,43.0,1980.0s
tt0267289,baap beti,1954.0,-,6.8,14,Drama            ,hindi,tt0267289,Drama,Add a Plot,Bimal Roy,"Sunalini Devi, Dolly, Tabassum Govil, Nasir Hussain",1,71.0,1950.0s
tt0307116,maa tujhhe salaam,2002.0,162 min,3.5,"1,134","Action, Drama            ",hindi,tt0307116,"Action, Drama",Major Pratab Singh works in the Indian army and he and his battalion has been assigned duty near the Indo-Pakistan border. There duty mainly consists of eliminating any terrorists trying to...                See full summary »,Tinnu Verma,"Sunny Deol, Tabu, Arbaaz Khan, Tinnu Verma",1,23.0,2000.0s
tt0995718,ek chalis ki last local,2007.0,143 min,7.3,"4,816","Adventure, Comedy, Crime            ",hindi,tt0995718,"Adventure, Comedy, Crime",A comic thriller about two people who miss the last local train at 1:40 am and how missing of their train changes their course of life forever.,Sanjay M. Khanduri,"Abhay Deol, Neha Dhupia, Amit Mistry, Nawazuddin Siddiqui",1,18.0,2000.0s
tt7094488,sandeep aur pinky faraar,2021.0,125 min,4.0,610,"Comedy, Crime, Drama            ",hindi,tt7094488,"Comedy, Crime, Drama","Sandeep, a bank executive and Pinky, a suspended cop, are marked for a kill. Phones tapped, accounts blocked, they escape but escaping is not freedom.",Dibakar Banerjee,"Jaideep Ahlawat, Parineeti Chopra, Arjun Kapoor, Neena Gupta",1,4.0,2020.0s
tt9635540,darbar,2020.0,159 min,6.1,"4,929","Action, Thriller            ",tamil,tt9635540,"Action, Crime, Thriller",A police officer is on a chase to hunt down a dreaded gangster to fulfill his own secret agenda.,A.R. Murugadoss,"Rajinikanth, Nayanthara, Nivetha Thomas, Suniel Shetty",1,5.0,2020.0s
tt10305616,malaal,2019.0,136 min,5.9,823,"Action, Drama, Romance            ",hindi,tt10305616,"Action, Drama, Romance","Malaal is the story of Shiva and Astha, two very different people from contrasting backgrounds who experience the innocence of love. Does their love find its destination or do they part ways? Stay on this journey to find out.",Mangesh Hadawale,"Meezaan Jafri, Sharmin Segal, Chinmayee Surve, Anil Gawas",1,6.0,2010.0s
tt0250122,yeshwant,1997.0,145 min,7.2,"1,054","Action, Crime, Drama            ",hindi,tt0250122,"Action, Crime, Drama","Tough policier about a straight, but maverick cop who does not believe in bending over, no matter what. He encourages his wife to become a top government officer and tutors her at home, ...                See full summary »",Anil Mattoo,"Nana Patekar, Madhoo, Atul Agnihotri, Mohan Joshi",1,28.0,1990.0s
tt1255951,de dana dan,2009.0,162 min,5.5,"7,521","Action, Comedy, Crime            ",hindi,tt1255951,"Action, Comedy, Crime",Two down on their luck men tries to kidnap a wealthy businesswoman's dog to demand a hefty ransom from her. Things goes haywire when the dog goes missing.,Priyadarshan,"Akshay Kumar, Suniel Shetty, Katrina Kaif, Sameera Reddy",1,16.0,2000.0s
tt0251346,police aur mujrim,1992.0,146 min,5.3,49,"Action, Musical, Romance            ",hindi,tt0251346,"Action, Musical, Romance","Bombay's Police Commissioner Veer Bahadur Singh, lives with his wife, Sharda, and daughter, Jyoti. When DSP Vishal Khanna arrests two notorious robbers and pimps, Shera and Jaaga, and holds...                See full summary »",K.C. Bokadia,"Raaj Kumar, Vinod Khanna, Meenakshi Sheshadri, Avinash Wadhawan",1,33.0,1990.0s
tt0330217,dil ka rishta,2003.0,150 min,4.7,"1,597","Drama, Musical, Romance            ",hindi,tt0330217,"Drama, Musical, Romance","A man faces a dilemma after he accidentally kills his lover's fiancee and hides this secret from her, not knowing that it may create a rift in their lives.",Naresh Malhotra,"Arjun Rampal, Aishwarya Rai Bachchan, Priyanshu Chatterjee, Rakhee Gulzar",1,22.0,2000.0s
-,goodbye,2022.0,-,,-,"Comedy, Drama            ",hindi,tt14438964,"Comedy, Drama, Family",A heartwarming story of the Bhalla family that depicts their journey of grief and self-discovery after they suffer the loss of their loved one.,Vikas Bahl,"Amitabh Bachchan, Neena Gupta, Rashmika Mandanna, Pavail Gulati",1,3.0,2020.0s
tt1144804,kambakkht ishq,2009.0,142 min,3.9,"6,660","Action, Comedy, Romance            ",hindi,tt1144804,"Action, Comedy, Romance",A romantic comedy about an Indian stuntman who takes Hollywood by storm but cannot find true love.,Sabir Khan,"Sylvester Stallone, Denise Richards, Whoopi Goldberg, Akshay Kumar",1,16.0,2000.0s
tt1093370,jab we met,2007.0,138 min,7.9,"48,292","Comedy, Drama, Romance            ",hindi,tt1093370,"Comedy, Drama, Romance",A depressed wealthy businessman finds his life changing after he meets a spunky and care-free young woman.,Imtiaz Ali,"Shahid Kapoor, Kareena Kapoor, Tarun Arora, Dara Singh Randhawa",1,18.0,2000.0s
tt3043252,parched,2015.0,116 min,7.6,"4,877",Drama            ,hindi,tt3043252,Drama,"In the arid landscape of Rajasthan, four women navigate their way through personal and cultural difficulties.",Leena Yadav,"Tannishtha Chatterjee, Radhika Apte, Surveen Chawla, Lehar Khan",1,10.0,2010.0s
tt0220757,shool,1999.0,138 min,7.7,"2,856","Action, Crime, Drama            ",hindi,tt0220757,"Action, Crime, Drama","A tale of an honest cop set against the backdrop of the brutal, lawless system prevailing in the Indian state of Bihar, and the endless suffering he tolerates before all hell breaks loose.",Eeshwar Nivas,"Manoj Bajpayee, Raveena Tandon, Sayaji Shinde, Yashpal Sharma",1,26.0,1990.0s
tt1034449,kidnap,2008.0,135 min,4.6,"2,309","Action, Crime, Drama            ",hindi,tt1034449,"Action, Crime, Drama",A kidnapper has to settle a personal score with an influential businessman whose daughter he has kidnapped.,Sanjay Gadhvi,"Sanjay Dutt, Imran Khan, Minissha Lamba, Vidya Malvade",1,17.0,2000.0s
-,tadap,2021.0,-,,-,Thriller            ,hindi,tt10761694,"Action, Drama, Romance",Unforeseen circumstances threaten the passionate relationship between star-crossed lovers.,Milan Luthria,"Ahan Shetty, Tara Sutaria, Saurabh Shukla, Kumud Mishra",1,4.0,2020.0s
tt0120456,virasat,1997.0,165 min,7.5,"2,503","Drama, Family, Musical            ",hindi,tt0120456,"Action, Drama, Musical","After completing his studies in London, England, Shakti Thakur returns home to India in a small town where his family resides. Accompanying him is his leggy girlfriend, Anita, who he is in ...                See full summary »",Priyadarshan,"Anil Kapoor, Tabu, Pooja Batra, Milind Gunaji",1,28.0,1990.0s
tt0488381,corporate,2006.0,142 min,6.5,"1,941",Drama            ,hindi,tt0488381,Drama,Two corporate giants compete in order to recklessly maximize their respective profits.,Madhur Bhandarkar,"Bipasha Basu, Kay Kay Menon, Raj Babbar, Rajat Kapoor",1,19.0,2000.0s
tt0139859,annamalai,1992.0,164 min,7.7,"1,695","Action, Drama            ",tamil,tt0139859,"Action, Drama",A class-divided friendship goes through highs and lows through several decades.,Suresh Krishna,"Rajinikanth, Sarath Babu, Kushboo, Radha Ravi",1,33.0,1990.0s
tt5784860,aksar 2,2017.0,127 min,3.6,412,"Crime, Drama, Mystery            ",hindi,tt5784860,"Crime, Drama, Mystery",A husband's plan to break up his marriage so that he can be with another woman backfires with unexpected consequences.,Anant Mahadevan,"Zareen Khan, Gautam Rode, Lillete Dubey, Mukesh Hariawala",1,8.0,2010.0s
tt0114236,ravan raaj: a true story,1995.0,153 min,6.1,109,"Action, Crime, Thriller            ",hindi,tt0114236,"Action, Crime, Thriller",In Bombay a series of kidnapping takes place and many young women go missing. The police force is also not doing much to stop this until Arjun Verma is assigned to the case.During the ...                See full summary »,Rama Rao Tatineni,"Mithun Chakraborty, Madhoo, Aditya Pancholi, Paresh Rawal",1,30.0,1990.0s
tt0070558,pran jaye par vachan na jaye,1974.0,-,6.0,19,"Action, Drama, Musical            ",hindi,tt0070558,"Action, Drama, Musical",Raja Thakur (Sunil Dutt) is an outlaw who fights oppression and corruption in his own unique way. This Robin Hood like figure is a feared and respected figure among the villagers and when ...                See full summary »,S. Ali Raza,"Sunil Dutt, Rekha, Bindu Desai, Ranjeet Bedi",1,51.0,1970.0s
tt6148156,vikram vedha,2017.0,147 min,8.4,"29,746","Action, Crime, Drama            ",tamil,tt6148156,"Action, Crime, Drama","Vikram, a no-nonsense police officer, accompanied by Simon, his partner, is on the hunt to capture Vedha, a smuggler and a murderer. Vedha tries to change Vikram's life, which leads to a conflict.","Gayatri, Pushkar, Gowtham Selvaraj","Madhavan, Vijay Sethupathi, Shraddha Srinath, Kathir",1,8.0,2010.0s
