ID,movie_name,year,Timing(min),Rating(10),Votes,Genre,Language,movie_id,genre,overview,director,cast,is_indian,movie_age,release_decade
tt3683702,fugly,2014.0,134 min,4.7,"1,001","Drama, Thriller            ",hindi,tt3683702,"Drama, Thriller",Four friends fight against a corrupt police officer who extorts money from them for not framing them in a murder which the officer committed himself.,Kabir Sadanand,"Jimmy Shergill, Mohit Marwah, Kiara Advani, Vijender Singh",1,11.0,2010.0s
tt3836958,shamitabh,2015.0,155 min,6.8,"6,998",Drama            ,hindi,tt3836958,Drama,"An aspiring actor with the inability to speak, joins forces with a man who has a powerful voice. Together they take the film industry by storm, but will their egos get in the way?",R. Balki,"Amitabh Bachchan, Dhanush, Akshara Haasan, Abhinaya",1,10.0,2010.0s
tt1671446,aadhi bhagavan,2013.0,157 min,5.4,556,"Action, Crime, Thriller            ",telugu,tt1671446,"Action, Crime, Thriller",An action film about two lookalike criminals in which one wants the other to get killed.,Ameer Sultan,"Jayam Ravi, Nitu Chandra, Sudha Chandran, Saiju Kurup",1,12.0,2010.0s
tt6170954,naam shabana,2017.0,147 min,6.3,"5,752","Action, Thriller            ",hindi,tt6170954,"Action, Drama, Thriller","This Spin-off from Baby (2015) provides the back-story of intelligence agent Shabana, and chronicles how she becomes a spy.",Shivam Nair,"Taapsee Pannu, Akshay Kumar, Manoj Bajpayee, Taher Shabbir",1,8.0,2010.0s
tt0347278,jhankaar beats,2003.0,143 min,7.2,"1,948","Comedy, Music, Romance            ",hindi,tt0347278,"Comedy, Music, Romance","This is a story about love, friendship and music. Two copywriter brothers have lost in pop music contest called Jhankaar Beats for the last two years. They take the help of an apprentice to compete in a music contest.",Sujoy Ghosh,"Sanjay Suri, Rahul Bose, Juhi Chawla, Rinke Khanna",1,22.0,2000.0s
tt8396186,amavas,2019.0,134 min,2.7,301,"Horror, Thriller            ",hindi,tt8396186,"Horror, Thriller","The lives of a couple turn into a nightmare, as dark forces lie in wait beneath the shadows of the haunted bungalow in which they have decided to stay.",Bhushan Patel,"Ali Asgar, Ali Asgar, Vivan Bhatena, Sabina Chema",1,6.0,2010.0s
tt0073224,kaala sona,1975.0,137 min,6.4,59,"Action, Thriller            ",hindi,tt0073224,"Action, Thriller","Multi-millionaire businessman, Rakesh gets word from his servant, Ramdas that his father has been killed several years ago by a bandit named Poppy Singh and that Poppy Singh is still alive ...                See full summary »",Ravikant Nagaich,"Feroz Khan, Parveen Babi, Prem Chopra, Farida Jalal",1,50.0,1970.0s
tt11964084,virgin bhanupriya,2020.0,111 min,2.5,"1,088","Comedy, Drama            ",hindi,tt11964084,"Comedy, Drama","Bhanupriya, a conservative girl decides to lose her virginity but fails in her every attempt. A soothsayer predicts that it is an impossible task and it will not happen to her. She decides to overcome this bad luck.",Ajay Lohan,"Urvashi Rautela, Gautam Gulati, Rajiv Gupta, Archana Puran Singh",1,5.0,2020.0s
tt2181831,shahid,2012.0,129 min,8.2,"15,413","Biography, Drama            ",hindi,tt2181831,"Biography, Drama","The account of Human Rights lawyer Shahid Azmi, an ordinary citizen with an extraordinary commitment to justice.",Hansal Mehta,"Rajkummar Rao, Prabhleen Sandhu, Mohd. Zeeshan Ayyub, Baljinder Kaur",1,13.0,2010.0s
tt1395054,once upon a time in mumbaai,2010.0,134 min,7.4,"16,501","Action, Crime, Drama            ",hindi,tt1395054,"Action, Crime, Drama","As a smuggler rises to power in in 1970s Mumbai, a younger gangster seeks to overthrow him and a police officer is caught in the middle.",Milan Luthria,"Ajay Devgn, Emraan Hashmi, Kangana Ranaut, Prachi Desai",1,15.0,2010.0s
tt0211934,baadshah,1999.0,175 min,6.9,"17,005","Action, Comedy, Crime            ",hindi,tt0211934,"Action, Comedy, Crime",A small time detective is mistaken as a CBI agent and gets embroiled in a deadly mission to save the Chief Minister from an assassination attempt.,"Abbas Alibhai Burmawalla, Mastan Alibhai Burmawalla","Shah Rukh Khan, Twinkle Khanna, Amrish Puri, Johny Lever",1,26.0,1990.0s
tt7469726,shaadi mein zaroor aana,2017.0,137 min,7.6,"13,046","Drama, Romance            ",hindi,tt7469726,"Drama, Romance","Satyendra Mishra ""Rajkumar Rao"" and Aarti Shukla ""Kriti Kharbanda"" agree to get married arranged by their parents, after Satyendra Mishra get government job. Aarti Shukla, run away from their marriage. What life waits for them ahead?",Ratnaa Sinha,"Rajkummar Rao, Kriti Kharbanda, K.K. Raina, Alka Amin",1,8.0,2010.0s
tt9253188,kavacham,2018.0,141 min,5.5,445,"Action, Thriller            ",telugu,tt9253188,"Action, Crime, Thriller",A police officer from Vizag finds himself in a rut when false allegations are levied against him. He has 24 hours now to prove his innocence.,Sreenivas Mamilla,"Sai Srinivas Bellamkonda, Kajal Aggarwal, Mehreen Pirzada, Neil Nitin Mukesh",1,7.0,2010.0s
tt0150433,earth,1998.0,110 min,7.7,"7,472","Drama, Romance, War            ",hindi,tt0150433,"Drama, Romance, War",It's 1947 and the borderlines between India and Pakistan are being drawn. A young girl witnesses tragedy as her ayah (nanny) is caught between the love of two men and the rising tide of political and religious violence.,Deepa Mehta,"Aamir Khan, Nandita Das, Rahul Khanna, Maia Sethna",1,27.0,1990.0s
tt5542802,raabta,2017.0,147 min,4.6,"5,846","Action, Drama, Fantasy            ",hindi,tt5542802,"Action, Drama, Fantasy","An inseparable couple Saira and Shiva find themselves in a complicated situation when a stranger claims to be her reincarnated lover from their previous lifetime, hellbent on destroying their relationship and winning her back.",Dinesh Vijan,"Deepika Padukone, Kriti Sanon, Rajkummar Rao, Sushant Singh Rajput",1,8.0,2010.0s
tt0288427,angaaray,1998.0,141 min,5.3,782,"Action, Crime, Drama            ",hindi,tt0288427,"Action, Crime, Drama","A Bangalore-based police officer is told to go undercover in Mumbai, infiltrate the gang run by his childhood friends and bring them to justice.",Mahesh Bhatt,"Akshay Kumar, Nagarjuna Akkineni, Pooja Bhatt, Sonali Bendre",1,27.0,1990.0s
tt0995740,no smoking,2007.0,128 min,7.3,"6,789","Drama, Horror, Mystery            ",hindi,tt0995740,"Drama, Horror, Mystery",A heavily addicted smoker is unprepared for the true price he must pay when he asks a guru's help to kick the habit.,Anurag Kashyap,"John Abraham, Ayesha Takia, Paresh Rawal, Ranvir Shorey",1,18.0,2000.0s
tt4020624,lingaa,2014.0,174 min,5.6,"5,018","Action, Comedy, Drama            ",tamil,tt4020624,"Action, Comedy, Drama",A small-time thief reforms after learning about the role played by his grandfather in building a dam.,K.S. Ravikumar,"Rajinikanth, Anushka Shetty, Sonakshi Sinha, Jagapathi Babu",1,11.0,2010.0s
tt1600439,shaapit: the cursed,2010.0,145 min,5.4,818,"Adventure, Horror, Romance            ",hindi,tt1600439,"Adventure, Horror, Romance","In order to wed his sweetheart, a male must reverse a 350-year old curse on her family.",Vikram Bhatt,"Aditya Narayan, Shweta Agarwal, Rahul Dev, Shubh Joshi",1,15.0,2010.0s
tt0116690,jeet,1996.0,180 min,5.6,"2,093","Action, Romance            ",hindi,tt0116690,"Action, Romance","A hitman working for a crime boss falls for a woman but she is married off to her childhood friend. Later, when the woman's and her husband's life comes under threat from the crime boss, the hitman becomes their protector.",Raj Kanwar,"Sunny Deol, Karisma Kapoor, Salman Khan, Tabu",1,29.0,1990.0s
tt0248012,fiza,2000.0,170 min,6.1,"3,852","Action, Crime, Drama            ",urdu,tt0248012,"Crime, Drama, Romance",In 1993 Fiza's brother Aman disappears during the riots in Mumbai. In 1999 Fiza is tired of waiting and goes looking for him.,Khalid Mohamed,"Karisma Kapoor, Hrithik Roshan, Jaya Bachchan, Shabana Raza",1,25.0,2000.0s
tt1182937,rab ne bana di jodi,2008.0,167 min,7.2,"44,315","Comedy, Drama, Music            ",hindi,tt1182937,"Comedy, Drama, Music","A breathtaking, goose flesh igniting, awe inspiring love journey of an ordinary man Suri and his 'total opposite' love Taani.",Aditya Chopra,"Shah Rukh Khan, Anushka Sharma, Vinay Pathak, M.K. Raina",1,17.0,2000.0s
tt0093949,shahenshah,1988.0,175 min,6.3,"1,916","Action, Adventure            ",hindi,tt0093949,"Action, Adventure","Vijay who is a corrupt officer by day, turns a vigilante by night in order to make the city crime free.",Tinnu Anand,"Amitabh Bachchan, Meenakshi Sheshadri, Aruna Irani, Rohini Hattangadi",1,37.0,1980.0s
tt12567088,raat akeli hai,2020.0,149 min,7.3,"15,075","Crime, Drama, Mystery            ",hindi,tt12567088,"Crime, Drama, Mystery",The film follows a small town cop who is summoned to investigate the death of a politician which gets complicated by the victim's secretive family and his own conflicted heart.,Honey Trehan,"Ashish Chhipa, Nawazuddin Siddiqui, Radhika Apte, Aditya Srivastav",1,5.0,2020.0s
tt0118654,aunty no. 1,1998.0,160 min,4.3,575,"Comedy, Drama, Romance            ",hindi,tt0118654,"Action, Comedy, Drama","Sandhya (Raveena Tandon) has always dreamt of meeting her prince charming, a wealthy man, handsome, debonair, and dashing. She meets with Gopi (Govinda), who likes her instantly, and ...                See full summary »",Kirti Kumar,"Govinda, Raveena Tandon, Harish, Rohit Kumar Sharma",1,27.0,1990.0s
tt5697870,lucknow central,2017.0,133 min,6.2,"2,647","Action, Drama, Music            ",hindi,tt5697870,"Action, Crime, Drama","When an innocent man aspiring to be a musician is framed for committing a murder, he decides to form a music band with his co-prisoners for a competition, but his real intention seems to be different.",Ranjit Tewari,"Farhan Akhtar, Diana Penty, Ronit Roy, Gippy Grewal",1,8.0,2010.0s
tt0089552,mard,1985.0,177 min,6.2,"1,585","Action, Drama, Romance            ",hindi,tt0089552,"Action, Comedy, Drama","King Azad gets locked in a dungeon by the British general Dyer who wants to take over his kingdom. Years later, Azad's son decides to put an end to Dyer's tyranny and comes to his father's rescue.",Manmohan Desai,"Amitabh Bachchan, Amrita Singh, Nirupa Roy, Dara Singh Randhawa",1,40.0,1980.0s
tt0289725,jung,2000.0,147 min,4.2,359,"Action, Crime, Drama            ",hindi,tt0289725,"Action, Crime, Drama",A police officer is in a frantic search for a compatible bone-marrow donor for his gravely-ill son. The only match is a convicted vicious killer who is now on the run. All he has to do is catch him.,Sanjay Gupta,"Sanjay Dutt, Jackie Shroff, Aditya Pancholi, Raveena Tandon",1,25.0,2000.0s
tt0456144,lage raho munna bhai,2006.0,144 min,8.1,"43,571","Comedy, Drama, Romance            ",hindi,tt0456144,"Comedy, Drama, Romance",Munna Bhai embarks on a journey with Mahatma Gandhi in order to fight against a corrupt property dealer.,Rajkumar Hirani,"Sanjay Dutt, Arshad Warsi, Vidya Balan, Boman Irani",1,19.0,2000.0s
tt1971365,dangerous ishhq,2012.0,130 min,3.9,839,"Fantasy, Mystery, Romance            ",hindi,tt1971365,"Fantasy, Mystery, Romance",Three doppelgangers(one girl+ two boys).Two of them loves each other and get together from many lives .And the third one(who can't be killed easily)also wants the girl and he tries to separate them through many lives.,Vikram Bhatt,"Karisma Kapoor, Rajneesh Duggal, Divya Dutta, Jimmy Shergill",1,13.0,2010.0s
tt10318332,badnaam gali,2019.0,95 min,7.0,773,Comedy            ,hindi,tt10318332,Comedy,"It encompasses the journey of a surrogate mother, played by Patralekhaa, and her dynamic relationship with people around her.",Ashwin Shetty,"Patralekhaa Paul, Divyendu Sharma, Dolly Ahluwalia, Paritosh Sand",1,6.0,2010.0s
tt6903440,manikarnika: the queen of jhansi,2019.0,148 min,6.4,"9,963","Action, Biography, Drama            ",telugu,tt6903440,"Action, Biography, Drama","Story of Rani Lakshmibai, one of the leading figures of the Indian Rebellion of 1857, and her resistance to the British Rule.","Radha Krishna Jagarlamudi, Kangana Ranaut","Kangana Ranaut, Danny Denzongpa, Suresh Oberoi, Atul Kulkarni",1,6.0,2010.0s
tt0383719,xcuse me,2003.0,152 min,5.7,787,Comedy            ,hindi,tt0383719,Comedy,"Chantu and Bantu are two meddling friends who join a hotel management program in Goa by deceit. During their training, they expose the illicit activities of many hotel personnel and guests.",N. Chandra,"Sharman Joshi, Sahil Khan, Anil Chaudhary, Snehal Dabi",1,22.0,2000.0s
tt0246095,mutamestri,1993.0,163 min,7.1,304,"Action, Drama            ",telugu,tt0246095,"Action, Drama",The story of a vegetable market worker who rises to the state of a minister.,A. Kodandarami Reddy,"Chiranjeevi, Meena, Roja, Sharat Saxena",1,32.0,1990.0s
tt0378069,hum se badkar kaun,1981.0,-,6.0,42,"Adventure, Drama            ",hindi,tt0378069,"Adventure, Drama",Four young boys tragically separated from their parents and each other grow up to become four different men with divergent values and conflicting methods. Fate eventually sets their paths for a head on collision.,Deepak Bahry,"Ranjeet Bedi, Birbal, Mithun Chakraborty, Mohan Choti",1,44.0,1980.0s
tt0451850,paheli,2005.0,140 min,6.5,"12,595","Comedy, Drama, Fantasy            ",hindi,tt0451850,"Comedy, Drama, Fantasy",A folk tale - supernatural love story about a ghost who falls in love with a newlywed woman.,Amol Palekar,"Shah Rukh Khan, Rani Mukerji, Anupam Kher, Naseeruddin Shah",1,20.0,2000.0s
tt0100095,maine pyar kiya,1989.0,192 min,7.3,"10,749","Drama, Musical, Romance            ",hindi,tt0100095,"Drama, Musical, Romance","After Suman's father leaves her in the care of another family while he travels abroad, she falls in love with Prem. However, in order to for them to marry, Prem has to prove to Suman's father that he is not the same as his own dad.",Sooraj R. Barjatya,"Salman Khan, Bhagyashree Patwardhan, Alok Nath, Rajeev Verma",1,36.0,1980.0s
tt1728986,bol bachchan,2012.0,155 min,5.5,"8,262","Action, Comedy            ",hindi,tt1728986,"Action, Comedy","All hell breaks loose when a Muslim man breaks a temple lock to save a little child, thus for his safety keeps a Hindu name, where he starts making web of lies.",Rohit Shetty,"Amitabh Bachchan, Ajay Devgn, Abhishek Bachchan, Asin Thottumkal",1,13.0,2010.0s
tt0392360,love,1991.0,152 min,5.7,"1,071","Drama, Musical, Romance            ",hindi,tt0392360,"Drama, Musical, Romance","Prithvi and Maggie fall in love and decide to get married, but Maggie's mother objects looking at Prithvi's past.",Suresh Krishna,"Salman Khan, Arun Bakshi, Rita Bhaduri, Sunil Dhawan",1,34.0,1990.0s
tt2726810,junglee tarzan,2001.0,-,,-,Action            ,hindi,tt2726810,Action,A group of hunters come into a dense forest to recover a hidden treasure. Dacoit Aiappan captures this forest and is also searching for those valuable treasures. A jungle lady Bela confronts and restrains them from doing further wrong.,Kishan Shah,"Vijay Saxena, Nisha Kamat, Joginder Shelly, Jr. Shah Rukh Khan",1,24.0,2000.0s
tt8504014,good newwz,2019.0,134 min,7.0,"14,946",Comedy            ,hindi,tt8504014,"Comedy, Drama",Two couples with the same surname pursue in-vitro fertilization and wait for their upcoming babies. Trouble ensues when they find that the sperms of each couple have been mixed with each other.,"Raj Mehta, Kulwinder Singh, Ranjeet Singh","Akshay Kumar, Kareena Kapoor, Diljit Dosanjh, Kiara Advani",1,6.0,2010.0s
tt0109134,anjaam,1994.0,170 min,6.9,"6,020","Drama, Thriller            ",hindi,tt0109134,"Crime, Drama, Thriller",Vijay falls in love Shivani and proposes her only to be rejected every time. However his love turns into an obsession and turns her life into a hell.,Rahul Rawail,"Madhuri Dixit, Shah Rukh Khan, Tinnu Anand, Johny Lever",1,31.0,1990.0s
tt0080901,hum paanch,1980.0,163 min,6.5,188,"Action, Drama            ",hindi,tt0080901,"Action, Drama","Wealthy, lecherous Zamindar Thakur Vir Pratap Singh lords over a small region in rural India, mercilessly killing anyone who opposes his rule. He gets the male villagers addicted to ...                See full summary »",Bapu,"Sanjeev Kumar, Shabana Azmi, Mithun Chakraborty, Deepti Naval",1,45.0,1980.0s
tt1275863,love aaj kal,2009.0,128 min,6.8,"15,049","Comedy, Drama, Romance            ",hindi,tt1275863,"Comedy, Drama, Romance",An old-fashioned romantic tells his personal love story to a modern man who has just broken up with his girlfriend. Has love really ever changed?,Imtiaz Ali,"Saif Ali Khan, Deepika Padukone, Rishi Kapoor, Rahul Khanna",1,16.0,2000.0s
tt2073070,saheb biwi aur gangster,2011.0,118 min,7.2,"3,987","Action, Crime, Drama            ",hindi,tt2073070,"Action, Crime, Drama","Hired to kill a nobleman, the assassin instead falls for the former's unstable wife.",Tigmanshu Dhulia,"Jimmy Shergill, Mahie Gill, Randeep Hooda, Shreya Narayan",1,14.0,2010.0s
-,dhamaka,2021.0,-,,-,"Action, Thriller            ",hindi,tt13510660,"Action, Crime, Drama","Reassigned from TV to radio, a frustrated anchor sees both danger and opportunity when he receives threatening calls on the air.","Ram Madhvani, Heavenveer Singh Hayer","Kartik Aaryan, Mrunal Thakur, Amruta Subhash, Soham Majumdar",1,4.0,2020.0s
tt0114726,trimurti,1995.0,187 min,4.8,"2,481","Action, Drama            ",hindi,tt0114726,"Action, Drama","After being framed, a policewoman languishing in prison hopes that her three sons will deliver justice and restore her honor.",Mukul Anand,"Jackie Shroff, Anil Kapoor, Shah Rukh Khan, Priya Tendulkar",1,30.0,1990.0s
tt0244776,satyakam,1969.0,175 min,8.2,684,Drama            ,hindi,tt0244776,Drama,The tale begins in the final days of the British Raj in India. A cohort of engineering students graduate a few months before Independence. Satyapriya and Naren are among the graduate ...                See full summary »,Hrishikesh Mukherjee,"Ashok Kumar, Dharmendra, Sharmila Tagore, Rabi Ghosh",1,56.0,1960.0s
tt0358053,pyar ke do pal,1986.0,130 min,6.2,50,"Action, Drama            ",hindi,tt0358053,"Action, Drama","Twins separated by a court order meet at camp and decide to reunite their parents, unaware of the dark secret that drove them apart years before.",Rajiv Mehra,"Mithun Chakraborty, Bindu Desai, Krishan Dhawan, Jagdeep",1,39.0,1980.0s
tt1708532,ready,2011.0,145 min,4.7,"15,197","Action, Comedy            ",hindi,tt1708532,"Action, Comedy, Romance","Set in Thailand and India, a case of mistaken identity leads to love, and a man and his family concoct a grand scheme to win over the hearts of a woman and her greedy, conniving uncles.",Anees Bazmee,"Salman Khan, Asin Thottumkal, Paresh Rawal, Mahesh Manjrekar",1,14.0,2010.0s
tt0456413,fight club: members only,2006.0,140 min,3.3,"1,385","Action, Crime            ",hindi,tt0456413,"Action, Crime, Drama","Four college friends starts an underground fight club in order to earn quick money, nevertheless they become suspects of a murder of a man, who turns out to be the mob boss' brother.","Abhay Chopra, Vikram Chopra","Suniel Shetty, Sohail Khan, Zayed Khan, Dino Morea",1,19.0,2000.0s
tt10671436,barot house,2019.0,89 min,7.3,"1,054","Mystery, Thriller            ",hindi,tt10671436,"Mystery, Thriller",A series of inexplicable and gruesome killings tear the Barot family apart and destroy the close relationship between father and son. Who could be behind this mindless slaughter? When the ...                See full summary »,Bugs Bhargava Krishna,"Amit Sadh, Manjari Fadnnis, Aaryan Menghji, Kishaa Arora",1,6.0,2010.0s
tt5662932,raman raghav 2.0,2016.0,133 min,7.4,"13,185","Crime, Drama, Thriller            ",hindi,tt5662932,"Crime, Drama, Thriller","Ramanna, a maniac murderer, finds a soulmate in Raghavan, a policeman, who inspects his murder cases. He tries to make Raghavan realize how they both are similar.",Anurag Kashyap,"Nawazuddin Siddiqui, Vicky Kaushal, Sobhita Dhulipala, Mukesh Chhabra",1,9.0,2010.0s
tt3390572,haider,2014.0,160 min,8.1,"50,882","Action, Crime, Drama            ",hindi,tt3390572,"Action, Crime, Drama","A young man returns to Kashmir after his father's disappearance to confront his uncle, whom he suspects of playing a role in his father's fate.",Vishal Bhardwaj,"Shahid Kapoor, Tabu, Shraddha Kapoor, Kay Kay Menon",1,11.0,2010.0s
tt0374660,footpath,2003.0,164 min,5.3,814,"Action, Crime, Drama            ",hindi,tt0374660,"Action, Crime, Drama","Two friends of a man help him avenge his father's death. Years later, he reunites with his friends who have now become criminals. What they don't know, is that he is now an undercover cop.",Vikram Bhatt,"Aftab Shivdasani, Bipasha Basu, Rahul Dev, Emraan Hashmi",1,22.0,2000.0s
tt12505468,kadakh,2019.0,108 min,6.9,"1,264","Comedy, Drama, Thriller            ",hindi,tt12505468,"Comedy, Drama, Thriller","Sunil is home alone when the doorbell rings. The stranger at the door is the husband of Chhaya, a woman that Sunil is having an affair with. The man asks many uncomfortable questions about their affair, becoming more and more intrusive.",Rajat Kapoor,"Ranvir Shorey, Mansi Multani, Palomi Ghosh, Rajat Kapoor",1,6.0,2010.0s
tt9592496,pogaru,2021.0,160 min,6.4,"3,351",Action            ,kannada,tt9592496,Action,"Shiva, a local Ruffian is unstoppable in his path as he had garnered the support and affection of the general public by fighting against the injustice that comes their way.",Nanda Kishore,"Dhruva Sarja, Rashmika Mandanna, Sampath Raj, Chikkanna",1,4.0,2020.0s
tt7179784,irumbu thirai,2018.0,160 min,7.7,"3,882","Action, Thriller            ",tamil,tt7179784,"Action, Crime, Thriller",A soldier takes on a gang of cyber criminals when money goes missing from his account.,P.S. Mithran,"Vishal, Samantha Ruth Prabhu, Arjun Sarja, Delhi Ganesh",1,7.0,2010.0s
tt0293342,lajja,2001.0,202 min,6.7,"2,510","Action, Crime, Drama            ",hindi,tt0293342,"Action, Crime, Drama",The lives of four women from different places are the victims of male chauvinism and marital abuse. They decide to fight for their rights and dignity against the social norms and injustice.,Rajkumar Santoshi,"Manisha Koirala, Jackie Shroff, Madhuri Dixit, Ajay Devgn",1,24.0,2000.0s
tt0432047,sarkar,2005.0,124 min,7.6,"15,852","Action, Crime, Drama            ",hindi,tt0432047,"Action, Crime, Drama","Subhash Nagre runs a parallel government in the city where he has a cult following. When his enemies plot to murder him, his son takes charge and stands up against them.",Ram Gopal Varma,"Amitabh Bachchan, Abhishek Bachchan, Kay Kay Menon, Supriya Pathak",1,20.0,2000.0s
tt0135621,rakshak,1996.0,164 min,4.7,293,"Action, Thriller            ",hindi,tt0135621,"Action, Thriller",ASP Raj Sinha is assign with the task of bringing to justice the people who are responsible for printing and circulating fake currency notes. Raj is shocked when he learn that the leader ...                See full summary »,Ashok Honda,"Suniel Shetty, Karisma Kapoor, Sonali Bendre, Raghuvaran",1,29.0,1990.0s
tt3031896,lakeer ka fakeer,2013.0,113 min,5.4,128,Crime            ,hindi,tt3031896,Crime,"The film revolves around the lives of three friends-cum-petty crooks whose biggest crime is the fact that they reside in Mumbai's notorious area, where nefarious activities of the organized-crime syndicates take shape.",Zubair Khan,"Vinod Acharya, Vicky Ahuja, Saaikat Bagbaan, Ajaz Khan",1,12.0,2010.0s
tt6272828,mubarakan,2017.0,156 min,5.5,"3,535","Comedy, Romance            ",hindi,tt6272828,"Comedy, Romance","Singleton Kartar Singh is left with the responsibility of raising his 2 orphaned nephews. He asks his brother to raise Charan and his sister in London to raise Karan. When the twins cross continents, they leave behind a trail of confusion.",Anees Bazmee,"Anil Kapoor, Arjun Kapoor, Ileana D'Cruz, Athiya Shetty",1,8.0,2010.0s
tt0060689,mera saaya,1966.0,128 min,7.6,856,"Drama, Musical, Mystery            ",hindi,tt0060689,"Drama, Musical, Mystery","A lawyer's wife dies in his arms. Yet, another woman - identical in appearance and accused of aiding a gang of bandits - claims to be the lawyer's wife. A courtroom drama ensues.",Raj Khosla,"Sunil Dutt, Sadhana Shivdasani, Jagdish Sethi, K.N. Singh",1,59.0,1960.0s
tt12393526,bulbbul,2020.0,94 min,6.5,"9,782","Drama, Horror, Mystery            ",hindi,tt12393526,"Drama, Horror, Mystery","A man returns home after years to find his brother's child bride now grown up and abandoned, and his ancestral village plagued by mysterious deaths.",Anvita Dutt,"Triptii Dimri, Avinash Tiwary, Rahul Bose, Parambrata Chattopadhyay",1,5.0,2020.0s
-,ek villain returns,2022.0,-,,-,"Action, Thriller            ",hindi,tt11947158,"Action, Crime, Romance",The story of two men in one sided love. The paths they choose to fulfill their love stories decide who the Hero is and who is the Villain.,Mohit Suri,"John Abraham, Disha Patani, Arjun Kapoor, Tara Sutaria",1,3.0,2020.0s
tt0215517,angoor,1982.0,131 min,8.3,"4,858",Comedy            ,hindi,tt0215517,Comedy,"Based on Shakespeare's 'A Comedy of Errors', this is a story of identical twins (2 pairs) and mistaken identities.",Gulzar,"Sanjeev Kumar, Moushumi Chatterjee, Deven Verma, Aruna Irani",1,43.0,1980.0s
tt0490210,sarkar raj,2008.0,125 min,6.7,"7,242","Action, Crime, Drama            ",hindi,tt0490210,"Action, Crime, Drama",An even more powerful gang emerges to wipe out Sarkar from the playground. A power plant proposal becomes a cause for greater political turmoil around him. What happens to the Family?,Ram Gopal Varma,"Amitabh Bachchan, Abhishek Bachchan, Aishwarya Rai Bachchan, Ravi Kale",1,17.0,2000.0s
tt10731264,suraj pe mangal bhari,2020.0,141 min,5.8,"2,834",Comedy            ,hindi,tt10731264,Comedy,"In the 1990s, a wedding detective has to perform background checks on prospective grooms. In the time before social media and mobile phones, everything has to be done in person.",Abhishek Sharma,"Manoj Bajpayee, Karishma Tanna, Fatima Sana Shaikh, Abhishek Banerjee",1,5.0,2020.0s
