ID,movie_name,year,Timing(min),Rating(10),Votes,Genre,Language,movie_id,genre,overview,director,cast,is_indian,movie_age,release_decade
tt0493437,apna sapna money money,2006.0,134 min,5.3,"1,892","Comedy, Musical, Romance            ",hindi,tt0493437,"Comedy, Musical, Romance","Kishan is a young man from Goa whose brain is full of every conceivable trick to make a quick buck. He cons people by slipping into different outfits and by assuming many guises. Julie, is ...                See full summary »",Sangeeth Sivan,"Riteish Deshmukh, Shreyas Talpade, Riya Sen, Koena Mitra",1,19.0,2000.0s
tt0246905,saajan chale sasural,1996.0,134 min,6.0,"1,312","Comedy, Drama            ",hindi,tt0246905,"Comedy, Drama",A village-based singer attempts to find love and fame in the big city.,David Dhawan,"Govinda, Karisma Kapoor, Tabu, Shakti Kapoor",1,29.0,1990.0s
tt8622232,time to dance,2021.0,113 min,1.3,406,"Musical, Romance            ",hindi,tt8622232,"Musical, Romance","When a ballroom dancer's shot at a crucial tournament is jeopardized, a street dancer must face his own painful past and step up as her new partner.",Stanley D'Costa,"Sooraj Pancholi, Isabelle Kaif, Waluscha D'Souza, Rajpal Naurang Yadav",1,4.0,2020.0s
tt0187351,nigahen: nagina part ii,1989.0,140 min,5.2,286,"Drama, Family, Fantasy            ",hindi,tt0187351,"Drama, Family, Fantasy","After the tragic deaths of his son Ajit and daughter-in-law Rajni, Raja Saheb decides to educate his granddaughter Neelam in the city. Years later, Neelam has grown up and returns ...                See full summary »",Harmesh Malhotra,"Sunny Deol, Sridevi, Anupam Kher, Gulshan Grover",1,36.0,1980.0s
tt0225515,dillagi,1999.0,188 min,5.3,"1,068","Drama, Musical, Romance            ",hindi,tt0225515,"Drama, Musical, Romance","When Ranvir, the responsible elder brother of a middle-class Indian family, realises that his reckless younger brother Rajvir is in love, he arranges for Rajvir's marriage, not realising that the girl is the same person he is in love with.",Sunny Deol,"Sunny Deol, Bobby Deol, Urmila Matondkar, Dara Singh Randhawa",1,26.0,1990.0s
tt0186871,bhagwaan dada,1986.0,147 min,4.3,167,"Drama, Thriller            ",hindi,tt0186871,"Drama, Thriller","Naive village-born Swaroop comes to Bombay city with a only Rs.80/-, which he loses to a thief. A man named Bhagwaan helps Swaroop recover this amount, and asks him to return back to his ...                See full summary »",J. Om Prakash,"Rajinikanth, Rakesh Roshan, Sridevi, Danny Denzongpa",1,39.0,1980.0s
tt1092005,golmaal returns,2008.0,135 min,5.1,"7,115","Comedy, Crime, Mystery            ",hindi,tt1092005,"Comedy, Crime, Mystery","A man is sandwiched between his over possessive wife and a police inspector, where he is suspected for adultery and murder.",Rohit Shetty,"Ajay Devgn, Kareena Kapoor, Arshad Warsi, Tusshar Kapoor",1,17.0,2000.0s
tt1580704,that girl in yellow boots,2010.0,103 min,6.6,"3,574","Crime, Drama, Mystery            ",kannada,tt1580704,"Crime, Drama, Mystery",A British woman faces challenges while attempting to locate her father in India.,Anurag Kashyap,"Kalki Koechlin, Prashant Prakash, Naseeruddin Shah, Gulshan Devaiah",1,15.0,2010.0s
tt0203289,american desi,2001.0,100 min,6.6,"1,583","Comedy, Drama, Romance            ",hindi,tt0203289,"Comedy, Drama, Romance","College freshman Krishna Reddy, who has never cared for his Indian-American cultural heritage, looks forward to a new life on campus but is surprised to find that he has been assigned ...                See full summary »",Piyush Dinker Pandya,"Deep Katdare, Ronobir Lahiri, Purva Bedi, Rizwan Manji",1,24.0,2000.0s
tt6588966,hichki,2018.0,116 min,7.5,"10,905","Comedy, Drama            ",hindi,tt6588966,"Comedy, Drama","Suffering from Tourette Syndrome, Naina gets assigned a class of defiant students and must ensure that her students realise their potential.",Malhotra P. Siddharth,"Rani Mukerji, Naisha Khanna, Neeraj Kabi, Rohit Saraf",1,7.0,2010.0s
tt11102314,tribhanga,2021.0,95 min,6.1,"2,406","Drama, Family            ",hindi,tt11102314,"Drama, Family",The lives of three women spanning the late 1980s to present day and underscores the value of family in everyday life.,Renuka Shahane,"Kajol, Tanvi Azmi, Mithila Palkar, Kunaal Roy Kapur",1,4.0,2020.0s
tt3848938,mr. x,2015.0,133 min,3.8,"1,816","Action, Drama, Sci-Fi            ",hindi,tt3848938,"Action, Crime, Drama","After gaining the power of invisibility; a man becomes a vigilante, in order to take revenge on those who have wronged him.",Vikram Bhatt,"Emraan Hashmi, Amyra Dastur, Tanmay Bhat, Sushil Pandey",1,10.0,2010.0s
tt10852008,balakot: the true story,2020.0,-,,-,Action            ,hindi,tt10852008,Action,Film on Balakot air strikes 2019.,Omung Kumar,Vivek Oberoi,1,5.0,2020.0s
tt0242519,hera pheri,2000.0,156 min,8.2,"58,037","Action, Comedy, Crime            ",hindi,tt0242519,"Action, Comedy, Crime","Three unemployed men look for answers to all their money problems - but when their opportunity arrives, will they know what to do with it?",Priyadarshan,"Akshay Kumar, Suniel Shetty, Paresh Rawal, Tabu",1,25.0,2000.0s
tt1954206,the dirty picture,2011.0,145 min,6.6,"8,815","Biography, Comedy, Drama            ",tamil,tt1954206,"Biography, Comedy, Drama","The love story between an actress and a director, inspired by the life of the late south Indian actress Silk Smitha.",Milan Luthria,"Vidya Balan, Emraan Hashmi, Tusshar Kapoor, Naseeruddin Shah",1,14.0,2010.0s
tt5286444,neerja,2016.0,122 min,7.7,"21,192","Biography, Drama, Thriller            ",hindi,tt5286444,"Biography, Drama, Thriller","The story of courageous Neerja Bhanot, who sacrificed her life while protecting the lives of 359 passengers on Pan Am Flight 73 in 1986 when it was hijacked by a terrorist organization.",Ram Madhvani,"Sonam Kapoor, Shabana Azmi, Yogendra Tikku, Abrar Zahoor",1,9.0,2010.0s
tt0115568,army,1996.0,153 min,4.3,"1,591","Action, Drama            ",hindi,tt0115568,"Action, Drama","Arjun, a newlywed Army man, is brutally killed by a gangster, Nagraj. His young widow, determined to avenge her husband's death, raises an army of dedicated young men to kill the gangster.",Raam Shetty,"Sridevi, Shah Rukh Khan, Harish, Mohnish Behl",1,29.0,1990.0s
tt0345177,ek doctor ki maut,1990.0,122 min,8.3,"1,309","Biography, Drama            ",hindi,tt0345177,"Biography, Drama","After years of painstaking research at the cost of his domestic pleasure, Dr. Dipankar Roy discovers a vaccine for leprosy. The news is flashed over television and overnight, an ...                See full summary »",Tapan Sinha,"Shabana Azmi, Pankaj Kapur, Irrfan Khan, Deepa Sahi",1,35.0,1990.0s
tt0408976,krishna cottage,2004.0,124 min,5.1,"1,004","Horror, Mystery            ",hindi,tt0408976,"Horror, Mystery, Romance",A group of collegians are forced to take shelter in a mysterious Krishna Cottage for the night. Little do they know that the cottage is haunted by a spirit.,Santram Varma,"Sohail Khan, Isha Koppikar, Anita Hassanandani Reddy, Rati Agnihotri",1,21.0,2000.0s
tt4228746,zid,2014.0,126 min,4.4,"1,066","Crime, Romance, Thriller            ",hindi,tt4228746,"Crime, Romance, Thriller","A journalist, who is still in love with his ex-girlfriend, becomes the obsession of his landlord's daughter.",Vivek Agnihotri,"Mannara Chopra, Karanvir Sharma, Shraddha Das, Denzil Smith",1,11.0,2010.0s
tt8983164,chhalaang,2020.0,136 min,6.4,"15,444","Comedy, Drama            ",hindi,tt8983164,"Comedy, Drama, Sport",Chhalaang is a hilarious yet inspiring journey by Montu.,Hansal Mehta,"Rajkummar Rao, Nushrratt Bharuccha, Mohd. Zeeshan Ayyub, Saurabh Shukla",1,5.0,2020.0s
tt9176102,tuesdays and fridays,2021.0,106 min,4.5,407,"Comedy, Musical, Romance            ",hindi,tt9176102,"Comedy, Musical, Romance","To avoid the burden of commitment, a young lawyer and a writer agree to be romantic partners only two days a week. That won't get complicated - right?",Taranveer Singh,"Anmol Dhillon, Jhataleka Malhotra, Niki Walia, Zoa Morani",1,4.0,2020.0s
tt0093578,mr. india,1987.0,179 min,7.8,"14,265","Action, Comedy, Drama            ",hindi,tt0093578,"Action, Comedy, Drama","A poor but big-hearted man takes orphans into his home. After discovering his scientist father's invisibility device, he rises to the occasion and fights to save his children and all of India from the clutches of a megalomaniac.",Shekhar Kapur,"Anil Kapoor, Sridevi, Amrish Puri, Satish Kaushik",1,38.0,1980.0s
tt6471054,ajji,2017.0,104 min,6.9,939,Drama            ,hindi,tt6471054,"Crime, Drama",Little Manda is found raped and dumped in a trash heap near her slum. Her parents are more concerned with survival than dignity. The cops are powerless to help as the rapist is a local ...                See full summary »,Devashish Makhija,"Sushama Deshpande, Smita Tambe, Sharvani Suryavanshi, Abhishek Banerjee",1,8.0,2010.0s
tt0449306,lucky: no time for love,2005.0,180 min,4.7,"3,276","Musical, Drama, Romance            ",hindi,tt0449306,"Musical, Drama, Romance","In a chain of unfortunate events, a 17-year-old schoolgirl narrowly escapes a possible rapist, is caught up in a terror attack, and drinks contaminated water that poisons her.","Radhika Rao, Vinay Sapru","Salman Khan, Sneha Ullal, Mithun Chakraborty, Kader Khan",1,20.0,2000.0s
tt0105866,yalgaar,1992.0,192 min,5.4,413,"Action, Drama, Thriller            ",hindi,tt0105866,"Action, Drama, Thriller",Childhood friends became enemies when one Mahendra Ashwini Kumar grows up to be Additional Police Commissioner and the other Raj Pratap Singhal becomes a smuggler. Mahendra have two sons ...                See full summary »,Feroz Khan,"Feroz Khan, Sanjay Dutt, Kabir Bedi, Manisha Koirala",1,33.0,1990.0s
tt0466367,chand sa roshan chehra,2005.0,120 min,4.8,52,Romance            ,hindi,tt0466367,Romance,Teen lovers are separated by parental snobbery; their efforts to reunite drive the plot.,Shahab Shamsi,"Samir Aftab, Shabbir Ahluwalia, Shahid Ahmed, Talat Aziz",1,20.0,2000.0s
tt2387495,jalpari: the desert mermaid,2012.0,94 min,7.1,371,"Drama, Family, Mystery            ",hindi,tt2387495,"Drama, Family, Mystery","When they travel to their father's ancestral village, city kids expecting a natural paradise instead find a poor, dusty town that harbors secrets.",Nila Madhab Panda,"Lehar Khan, Krishang Trivedi, Parvin Dabas, Suhasini Mulay",1,13.0,2010.0s
tt2615584,phata poster nikhla hero,2013.0,146 min,4.8,"4,423","Action, Comedy            ",hindi,tt2615584,"Action, Comedy, Crime",Vishwas Rao is raised by his mother who wants him to become a police officer while he wants to become an actor.,Rajkumar Santoshi,"Shahid Kapoor, Ileana D'Cruz, Padmini Kolhapure, Mukesh Tiwari",1,12.0,2010.0s
tt0242314,billoo baadshah,1989.0,148 min,4.6,39,"Action, Crime, Drama            ",hindi,tt0242314,"Action, Crime, Drama",An orphan makes sacrifices for the family who took him in but subsequently faces humiliation and homelessness.,Sisir Misra,"Shatrughan Sinha, Anita Raj, Govinda, Neelam Kothari",1,36.0,1980.0s
tt0897374,munna,2007.0,167 min,5.6,863,Action            ,telugu,tt0897374,Action,"Munna is a college student who targets Khakha, a local gangster with whom he has a personal vendetta since childhood.",Vamshi Paidipally,"Prabhas, Ileana D'Cruz, Prakash Raj, Kota Srinivasa Rao",1,18.0,2000.0s
tt1455811,khatta meetha,2010.0,157 min,5.7,"9,698","Comedy, Crime, Drama            ",hindi,tt1455811,"Comedy, Crime, Drama","A seemingly corrupt petty contractor faces challenges from the local municipality, his family, his employees, as well as a former girlfriend and her family.",Priyadarshan,"Akshay Kumar, Trisha Krishnan, Kulbhushan Kharbanda, Aruna Irani",1,15.0,2010.0s
tt0230055,bulandi,2000.0,175 min,5.4,624,"Action, Drama            ",hindi,tt0230055,"Action, Drama",A noble family presides over a small town in India.,Rama Rao Tatineni,"Anil Kapoor, Rekha, Raveena Tandon, Rajinikanth",1,25.0,2000.0s
tt3142232,heropanti,2014.0,146 min,5.3,"8,222","Action, Romance            ",hindi,tt3142232,"Action, Romance",Two young people find love despite the violent landscape in which they live.,Sabir Khan,"Tiger Shroff, Kriti Sanon, Parthaa Akerkar, Sunil Grover",1,11.0,2010.0s
-,satyameva jayate 2,2021.0,122 min,,-,"Action, Crime, Drama            ",hindi,tt10739666,"Action, Crime, Drama","Satyameva Jayate 2 revolves around the fight against injustice and misuse of power. From police and politicians to industrialists and a common man, the film will explore corruption in all spheres.",Milap Zaveri,"John Abraham, Divya Khosla Kumar, Harsh Chhaya, Gautami Kapoor",1,4.0,2020.0s
tt4807830,lipstick under my burkha,2016.0,117 min,6.8,"6,288","Comedy, Drama            ",hindi,tt4807830,"Comedy, Drama","In order to be independent and break free from the conservative society, four women sets on a journey to discover freedom and happiness.",Alankrita Shrivastava,"Aahana Kumra, Ratna Pathak Shah, Konkona Sen Sharma, Plabita Borthakur",1,9.0,2010.0s
tt0247911,aap mujhe achche lagne lage,2002.0,180 min,3.1,"2,330","Action, Drama, Romance            ",hindi,tt0247911,"Action, Drama, Romance","The daughter of a rich criminal industrial tycoon falls in love with a college boy. The tycoon, what a surprise, objects...",Vikram Bhatt,"Hrithik Roshan, Ameesha Patel, Kiran Kumar, Mukesh Tiwari",1,23.0,2000.0s
tt4865436,hate story 3,2015.0,126 min,4.5,"2,996","Drama, Thriller            ",hindi,tt4865436,"Drama, Thriller",Siya appears to be the bone of contention between warring businessmen Aditya and Saurav. But this one runs deeper than your average love triangle.,Vishal Pandya,"Sharman Joshi, Karan Singh Grover, Zareen Khan, Daisy Shah",1,10.0,2010.0s
tt0237022,balika badhu,1976.0,111 min,7.0,221,"Comedy, Drama, Romance            ",hindi,tt0237022,"Comedy, Drama, Romance","Set against the backdrop of a quaint village in British-ruled India, this exquisitely crafted social drama revolves around teenage couple Amal and Rajni. Their marriage is conducted with ...                See full summary »",Tarun Majumdar,"Sachin Pilgaonkar, Rajni Sharma, Govardhan Asrani, A.K. Hangal",1,49.0,1970.0s
tt0454435,'d',2005.0,107 min,6.8,"1,181","Crime, Drama, Thriller            ",hindi,tt0454435,"Crime, Drama, Thriller","Deshu, a mechanic from Dubai, comes home to Mumbai, and gets embroiled in a crime by accident. The film shows his meteoric rise from common, law-abiding man to underworld kingpin.",Vishram Sawant,"Randeep Hooda, Chunky Pandey, Rukhsar Rehman, Isha Koppikar",1,20.0,2000.0s
tt0222024,hum tumhare hain sanam,2002.0,174 min,5.4,"6,508","Drama, Romance            ",hindi,tt0222024,"Comedy, Drama, Romance","Gopal's blissful married life with Radha blemishes when Radha gets obsessed with the career of her friend, Suraj, who is a singer. Ripped apart by jealousy, Gopal deserts Radha.","K.S. Adiyaman, Sanjay Singh","Shah Rukh Khan, Madhuri Dixit, Salman Khan, Atul Agnihotri",1,23.0,2000.0s
tt1573072,housefull,2010.0,144 min,5.4,"12,948",Comedy            ,gujarati,tt1573072,"Comedy, Drama, Romance","Believing himself to be jinxed, a man attempts to find true love, but instead gets caught in a web of lies.",Sajid Khan,"Akshay Kumar, Deepika Padukone, Riteish Deshmukh, Lara Dutta",1,15.0,2010.0s
tt1191138,thoda pyaar thoda magic,2008.0,145 min,4.9,"2,355","Comedy, Drama, Family            ",hindi,tt1191138,"Comedy, Drama, Family","An angel, a man and 4 orphans come together to bring you a story filled with fun, excitement, tears, love and magic.",Kunal Kohli,"Saif Ali Khan, Rani Mukerji, Rishi Kapoor, Akshat Chopra",1,17.0,2000.0s
tt0140399,muthu,1995.0,132 min,7.6,"2,674","Action, Comedy, Drama            ",tamil,tt0140399,"Action, Comedy, Drama","The movie is about a loyal servant, Muthu (Rajni), working for Zamindar Malayasimman (Sarath Babu) and the cunning plans by the uncle of Malasimman to capture the whole wealth which uncovers some mystery about Muthu.",K.S. Ravikumar,"Rajinikanth, Meena, Sarath Babu, Senthil",1,30.0,1990.0s
tt0109010,1942: a love story,1994.0,157 min,7.2,"3,191","Action, Drama, History            ",hindi,tt0109010,"Action, Drama, History","A young Indian couple, both from wealthy backgrounds, find themselves caught up in the 1940's Indian revolutionary movement against their families whom are under the thumb a sadistic British general.",Vidhu Vinod Chopra,"Anil Kapoor, Jackie Shroff, Manisha Koirala, Anupam Kher",1,31.0,1990.0s
tt1608777,"lsd: love, sex aur dhokha",2010.0,155 min,7.1,"5,310","Comedy, Crime, Drama            ",punjabi,tt1608777,"Comedy, Crime, Drama","A video camcorder, a store security camera, and concealed cameras candidly expose lives in three loosely-linked tales.",Dibakar Banerjee,"Nushrratt Bharuccha, Anshuman Jha, Neha Chauhan, Rajkummar Rao",1,15.0,2010.0s
tt0067183,haré rama haré krishna,1971.0,149 min,7.3,764,"Drama, Musical            ",hindi,tt0067183,"Drama, Musical","In the background of the rise of the International Hare Krishna movement in the 1970s, is a Montreal-based family of the Jaiswals, consisting of mom, dad, son, Prashant, and daughter, ...                See full summary »",Dev Anand,"Zeenat Aman, Dev Anand, Mumtaz Askari, Baby Guddi",1,54.0,1970.0s
tt0222270,phir bhi dil hai hindustani,2000.0,160 min,6.2,"6,985","Comedy, Drama, Musical            ",hindi,tt0222270,"Comedy, Drama, Musical","In order to seek justice for a man who exacts vengeance on a politician, who was responsible for his daughter's death, two rival reporters teams up to help him to prove his innocence.",Aziz Mirza,"Shah Rukh Khan, Juhi Chawla, Johny Lever, Paresh Rawal",1,25.0,2000.0s
tt0444840,humko deewana kar gaye,2006.0,155 min,5.2,"3,941","Drama, Romance            ",hindi,tt0444840,"Drama, Romance","Aditya an engineer, travels to Canada for training. There he meets Jia a beautiful woman from an influential family. Fate keeps pushing the pair together, and even though both are already betrothed to others, Adi and Jia fall in love.",Raj Kanwar,"Akshay Kumar, Katrina Kaif, Bipasha Basu, Bhagyashree Patwardhan",1,19.0,2000.0s
tt2066062,shortcut romeo,2013.0,146 min,2.3,248,"Action, Crime, Drama            ",hindi,tt2066062,"Action, Crime, Drama",Suraj spots a couple making love on a golf course and video films the entire event. He blackmails the couple and asks them to ensure that he has a luxurious life in return for the footage.,Susi Ganesan,"Neil Nitin Mukesh, Ameesha Patel, Puja Gupta, Jatin Garewal",1,12.0,2010.0s
tt4556848,barkhaa,2015.0,127 min,5.1,311,"Drama, Romance            ",hindi,tt4556848,"Drama, Romance","Follows the relationship between two young minds, which took a unfavorable turn.",Shadaab Mirza,"Sara Loren, Priyanshu Chatterjee, Muntazir Ahmad, Taha Shah Badussha",1,10.0,2010.0s
tt0284137,gadar: ek prem katha,2001.0,170 min,7.2,"10,102","Action, Drama, Romance            ",punjabi,tt0284137,"Action, Drama, Romance","During the Partition of India in 1947, a Sikh truck driver falls in love with a Muslim girl belonging to an aristocratic family.",Anil Sharma,"Sunny Deol, Ameesha Patel, Amrish Puri, Lillete Dubey",1,24.0,2000.0s
tt0244528,hadh kar di aapne,2000.0,134 min,5.3,"1,721","Comedy, Romance            ",hindi,tt0244528,"Comedy, Romance","Raj, a detective, goes on a Europe trip for his friend's case. During the trip, he falls in love with Anjali, who is impersonating her best friend. Their journey together ensues romance and comic confusion.",Manoj Agrawal,"Govinda, Rani Mukerji, Johny Lever, Paresh Rawal",1,25.0,2000.0s
-,chandigarh kare aashiqui,2021.0,-,,-,Romance            ,hindi,tt12861850,"Comedy, Crime, Drama","Manu, a bodybuilder from Chandigarh, India, falls in love with Maanvi, a Zumba teacher. All seems well until a revelation causes turmoil in their love story.",Abhishek Kapoor,"Ayushmann Khurrana, Vaani Kapoor, Yograj Singh, Anjan Srivastav",1,4.0,2020.0s
tt1918927,luv ka the end,2011.0,106 min,4.8,"1,421","Comedy, Drama            ",hindi,tt1918927,"Comedy, Drama","Rhea, the girl next door falls in love with Luv Nanda, only to find out he is not as nice as she thought he was. She decides to get even with Luv Nanda.",Bumpy,"Shraddha Kapoor, Taha Shah Badussha, Errol Peter Marks, Meherzan Mazda",1,14.0,2010.0s
tt1166100,ghajini,2008.0,186 min,7.3,"57,025","Action, Drama, Mystery            ",urdu,tt1166100,"Action, Drama, Mystery",A short-term memory loss patient goes on a killing spree in order to avenge the death of his ladylove.,A.R. Murugadoss,"Aamir Khan, Asin Thottumkal, Jiah Khan, Aamir Naik",1,17.0,2000.0s
tt0414714,girlfriend,2004.0,126 min,3.1,342,Drama            ,hindi,tt0414714,Drama,"A man comes between two lesbian lovers, hence forming a triangle with bleak consequences.",Karan Razdan,"Isha Koppikar, Aashish Chaudhary, Amrita Arora, Sumit Nijhawan",1,21.0,2000.0s
tt1024943,om shanti om,2007.0,162 min,6.7,"39,455","Action, Comedy, Drama            ",hindi,tt1024943,"Action, Comedy, Drama","In the 1970s, Om, an aspiring actor, is murdered, but is immediately reincarnated into the present day. He attempts to discover the mystery of his demise and find Shanti, the love of his previous life.",Farah Khan,"Shah Rukh Khan, Deepika Padukone, Arjun Rampal, Kirron Kher",1,18.0,2000.0s
tt9108892,harami,2020.0,100 min,7.5,894,"Crime, Drama, Romance            ",hindi,tt9108892,"Crime, Drama, Romance","An orphan teenage pickpocket working in the trains of Mumbai along with his gang, embarks on a life-altering journey when faced by the daughter of one of his victims who's committed suicide after being robbed.",Shyam Madiraju,"Emraan Hashmi, Rizwan Shaikh, Dhanshree Patil, Harsh Rajendra Rane",1,5.0,2020.0s
tt0976026,cheeni kum,2007.0,140 min,6.8,"4,953","Comedy, Drama, Romance            ",hindi,tt0976026,"Comedy, Drama, Romance",An egotistical 64-year-old chef and confirmed bachelor falls for a woman 30 years his junior.,R. Balki,"Amitabh Bachchan, Tabu, Paresh Rawal, Zohra Sehgal",1,18.0,2000.0s
tt0363525,commando,1988.0,149 min,4.2,169,"Action, Drama, Romance            ",hindi,tt0363525,"Action, Drama, Romance",Chander joins the army as a Commando but has to deal with the corrupt officials who deal with international criminals.,Babbar Subhash,"Mithun Chakraborty, Mandakini, Hemant Birje, Kim",1,37.0,1980.0s
tt4896974,chimanee pakhre,2000.0,-,8.1,11,Drama            ,hindi,tt4896974,Drama,"Nandini is on last stage of cancer during this time tragedy strikes as her husband is killed by a village rival,Nandini now is forced to put all her four children for adoption to give them a better life.",Mahesh Kothare,"Anand Abhyankar, Laxmikant Berde, Priya Arun Berde, Nagesh Bhonsle",1,25.0,2000.0s
tt0364519,millitary raaj,1998.0,-,5.9,49,Action            ,hindi,tt0364519,Action,"An army major is transferred to a training camp after being blamed by the police for doing their job. However, when the law and order worsens, the police ask him to take over the nation's security.",Sanjay Sharma,"Mithun Chakraborty, Prem Chopra, Siddharth Dhawan, Irfan Kamal",1,27.0,1990.0s
tt10098288,roohi,2021.0,134 min,4.2,"5,716","Comedy, Horror            ",hindi,tt10098288,"Comedy, Horror","Hired to kidnap a bride, two bumbling pals get into a wacky predicament when one falls for their abductee, and the other falls for the spirit that possesses her.",Hardik Mehta,"Rajkummar Rao, Varun Sharma, Janhvi Kapoor, Alexx O'Nell",1,4.0,2020.0s
tt0137361,anupama,1966.0,148 min,7.4,403,"Drama, Romance            ",hindi,tt0137361,"Drama, Romance","Mohan Sharma (Tarun Bose) is a workaholic whose life changes dramatically after his wife dies giving birth to their daughter Uma (Sharmila Tagore). He despises the daughter by day, and ...                See full summary »",Hrishikesh Mukherjee,"Dharmendra, Sharmila Tagore, Shashikala Jawalkar, Deven Verma",1,59.0,1960.0s
tt1627924,mausam,2011.0,161 min,4.7,"5,233","Drama, Romance, War            ",punjabi,tt1627924,"Drama, Romance, War","A war, religious conflicts, and misunderstandings create obstacles for a couple of different faiths.",Pankaj Kapur,"Shahid Kapoor, Sonam Kapoor, Anupam Kher, Supriya Pathak",1,14.0,2010.0s
tt0054098,mughal-e-azam,1960.0,197 min,8.2,"7,409","Drama, Romance, War            ",urdu,tt0054098,"Drama, Romance, War",A 16th century prince falls in love with a court dancer and battles with his emperor father.,K. Asif,"Prithviraj Kapoor, Madhubala, Dilip Kumar, Durga Khote",1,65.0,1960.0s
tt0248617,yaadein...,2001.0,171 min,4.4,"3,285","Musical, Drama, Romance            ",hindi,tt0248617,"Musical, Drama, Romance","Raj is against love marriages and when his daughter Isha falls in love with Ronit Malhotra, he opposes their relationship. Will Ronit and Isha sacrifice their love for the sake of their parents or will they manage to convince them?",Subhash Ghai,"Hrithik Roshan, Jackie Shroff, Kareena Kapoor, Amrish Puri",1,24.0,2000.0s
tt0260222,naseeb apna apna,1986.0,140 min,5.6,159,"Comedy, Drama            ",hindi,tt0260222,"Comedy, Drama","A domineering man marries his son to a simple village girl. But when she arrives at his house in the city, she discovers that he is already married to an attractive city woman.",Rama Rao Tatineni,"Rishi Kapoor, Farha Naaz, Radhika Sarathkumar, Rakesh Bedi",1,39.0,1980.0s
tt0430381,musafir,2004.0,151 min,5.5,"1,720","Action, Crime, Drama            ",hindi,tt0430381,"Action, Crime, Drama","A small-time criminal, betrayed by his girlfriend and owing money to a fearsome crime lord, agrees to travel to Goa for a drug deal and becomes involved with a local woman and her much older husband, both of who want to kill each other.","Sanjay Gupta, Hasib Muhammad","Anil Kapoor, Sameera Reddy, Aditya Pancholi, Mahesh Manjrekar",1,21.0,2000.0s
